{
    "$schema": "http://json-schema.org/draft-07/schema#",
    "title": "PriceData",
    "type": "object",
    "properties": {
      "mkey": {
        "type": "string"
      },
      "MATNR": {
        "type": "string"
      },
      "MTART": {
        "type": "string"
      },
      "MLFB_PRINT": {
        "type": "string"
      },
      "MLFB_SORT": {
        "type": "string"
      },
      "SHORT_OPTIONS": {
        "type": "string"
      },
      "TECH_PRDGR": {
        "type": "string"
      },
      "SENDE_ORGID": {
        "type": "string"
      },
      "PRODV": {
        "type": "string"
      },
      "MVKE_VKORG": {
        "type": "string"
      },
      "MVKE_VMSTA": {
        "type": "string"
      },
      "MVKE_VMSTD": {
        "type": "string"
      },
      "MVKE_VGBK": {
        "type": "string"
      },
      "MVKE_EGHID": {
        "type": "string"
      },
      "MVKE_VFGRP": {
        "type": "string"
      },
      "MVKE_PRGRP_GG": {
        "type": "string"
      },
      "MVKE_BSPER": {
        "type": "string"
      },
      "MVKE_TIEFG": {
        "type": "string"
      },
      "MVKE_BWARN": {
        "type": "string"
      },
      "MVKE_PRAUSG": {
        "type": "string"
      },
      "MVKE_DIV02L": {
        "type": "string"
      },
      "KBETR_ZLP0_HQ": {
        "type": "string"
      },
      "KBETR_ZLP0_RG": {
        "type": "string"
      },
      "LIFZ_N001": {
        "type": "string"
      },
      "LIFZ_N002": {
        "type": "string"
      },
      "LIFZ_N003": {
        "type": "string"
      },
      "MEAN_HE": {
        "type": "string"
      },
      "MEAN_UC": {
        "type": "string"
      }
    },
    "required": [
      "mkey",
      "MATNR",
      "MLFB_PRINT",
      "MLFB_SORT",
      "MVKE_VKORG",
      "MVKE_VMSTA"
    ]
  }
  