{
    "mkey": "ABCDEFGHI",
    "MATNR": "ABCDEFGH",
    "MLFB_PRINT": "ABCDEFG",
    "MLFB_SORT": "ABCDEFGHIJK",
    "MVKE_VKORG": "ABCDEFGHIJKLMNOPQRSTUVWX",
    "MVKE_VMSTA": "ABCDEFGHIJKLMNOPQRSTUV",
    "MTART": "ABCDEFGHIJKLMNO",
    "SHORT_OPTIONS": "ABCDEFGHIJKLM",
    "TECH_PRDGR": "ABCDEFGHIJKLMNOPQRSTU",
    "SENDE_ORGID": "ABCDEFGHIJKL",
    "PRODV": "ABCDEFGHIJK",
    "MVKE_VMSTD": "ABCDEFGHIJKLMNO",
    "MVKE_VGBK": "ABCDEFGHIJKLMNOPQR",
    "MVKE_EGHID": "ABCDEFGHIJKLMNOPQRSTUVWX",
    "MVKE_VFGRP": "ABCDEFGHIJKLMNOPQRST",
    "MVKE_PRGRP_GG": "ABCDE",
    "MVKE_BSPER": "ABCDEFGHIJKLMNOPQRSTUVWXYZ",
    "MVKE_TIEFG": "ABCDEFGHIJKLMNOPQ",
    "MVKE_BWARN": "ABCDEFG",
    "MVKE_PRAUSG": "ABCDEFGHIJKLMNOPQRS",
    "MVKE_DIV02L": "ABCDEFGHIJKLMNOPQRSTUVWXYZ",
    "KBETR_ZLP0_HQ": "ABCDEFGHIJKLMNOPQRSTUVWX",
    "KBETR_ZLP0_RG": "ABCDEFGHIJKLMN",
    "LIFZ_N001": "ABCDEFGHIJKLMNOPQRSTUVWXYZABC",
    "LIFZ_N002": "ABCDEFGHIJKLMNOPQRSTUVWXY",
    "LIFZ_N003": "ABCDEFGHIJKLMNOPQR",
    "MEAN_HE": "ABCDEFGHIJKLMNOPQRSTUVWXYZAB",
    "MEAN_UC": "ABCDEFGHIJKLMNOPQRSTU"
  }